"Query","Expected","T1: gpt-4o-mini, k=3, chunk=500 Answer","T1: gpt-4o-mini, k=3, chunk=500 Pass","T2: gpt-4.1-nano, k=5, chunk=800 Answer","T2: gpt-4.1-nano, k=5, chunk=800 Pass","T3: gpt-4.1-nano, k=2, chunk=800 Answer","T3: gpt-4.1-nano, k=2, chunk=800 Pass","T4: gpt-4.1-mini, k=2, chunk=300 Answer","T4: gpt-4.1-mini, k=2, chunk=300 Pass","T5: gpt-4.1-mini, k=2, chunk=300 Answer","T5: gpt-4.1-mini, k=2, chunk=300 Pass","T6: gpt-4.1-mini, k=2, chunk=500 Answer","T6: gpt-4.1-mini, k=2, chunk=500 Pass","T7: gpt-4.1-nano, k=2, chunk=300 Answer","T7: gpt-4.1-nano, k=2, chunk=300 Pass","T8: gpt-4.1-nano, k=3, chunk=500 Answer","T8: gpt-4.1-nano, k=3, chunk=500 Pass","T9: gpt-4o-mini, k=3, chunk=800 Answer","T9: gpt-4o-mini, k=3, chunk=800 Pass","T10: gpt-4.1-nano, k=2, chunk=500 Answer","T10: gpt-4.1-nano, k=2, chunk=500 Pass","T11: gpt-4.1-mini, k=3, chunk=500 Answer","T11: gpt-4.1-mini, k=3, chunk=500 Pass","T12: gpt-4o-mini, k=2, chunk=800 Answer","T12: gpt-4o-mini, k=2, chunk=800 Pass","T13: gpt-4.1-mini, k=3, chunk=300 Answer","T13: gpt-4.1-mini, k=3, chunk=300 Pass","T14: gpt-4.1-nano, k=5, chunk=800 Answer","T14: gpt-4.1-nano, k=5, chunk=800 Pass","T15: gpt-4.1-mini, k=3, chunk=300 Answer","T15: gpt-4.1-mini, k=3, chunk=300 Pass","T16: gpt-4.1-nano, k=2, chunk=300 Answer","T16: gpt-4.1-nano, k=2, chunk=300 Pass","T17: gpt-4.1-nano, k=2, chunk=300 Answer","T17: gpt-4.1-nano, k=2, chunk=300 Pass","T18: gpt-4.1-nano, k=3, chunk=300 Answer","T18: gpt-4.1-nano, k=3, chunk=300 Pass","T19: gpt-4.1-nano, k=2, chunk=500 Answer","T19: gpt-4.1-nano, k=2, chunk=500 Pass","T20: gpt-4.1-nano, k=5, chunk=800 Answer","T20: gpt-4.1-nano, k=5, chunk=800 Pass","T21: gpt-4.1-nano, k=5, chunk=500 Answer","T21: gpt-4.1-nano, k=5, chunk=500 Pass","T22: gpt-4.1-nano, k=3, chunk=800 Answer","T22: gpt-4.1-nano, k=3, chunk=800 Pass","T23: gpt-4.1-nano, k=5, chunk=800 Answer","T23: gpt-4.1-nano, k=5, chunk=800 Pass","T24: gpt-4.1-nano, k=5, chunk=500 Answer","T24: gpt-4.1-nano, k=5, chunk=500 Pass","T25: gpt-4.1-mini, k=2, chunk=500 Answer","T25: gpt-4.1-mini, k=2, chunk=500 Pass","T26: gpt-4o-mini, k=3, chunk=500 Answer","T26: gpt-4o-mini, k=3, chunk=500 Pass","T27: gpt-4o-mini, k=5, chunk=300 Answer","T27: gpt-4o-mini, k=5, chunk=300 Pass","T28: gpt-4o-mini, k=5, chunk=500 Answer","T28: gpt-4o-mini, k=5, chunk=500 Pass","T29: gpt-4.1-nano, k=5, chunk=500 Answer","T29: gpt-4.1-nano, k=5, chunk=500 Pass","T30: gpt-4.1-mini, k=2, chunk=300 Answer","T30: gpt-4.1-mini, k=2, chunk=300 Pass","T31: gpt-4.1-nano, k=5, chunk=800 Answer","T31: gpt-4.1-nano, k=5, chunk=800 Pass","T32: gpt-4.1-mini, k=3, chunk=300 Answer","T32: gpt-4.1-mini, k=3, chunk=300 Pass","T33: gpt-4.1-nano, k=2, chunk=500 Answer","T33: gpt-4.1-nano, k=2, chunk=500 Pass","T34: gpt-4.1-mini, k=2, chunk=300 Answer","T34: gpt-4.1-mini, k=2, chunk=300 Pass","T35: gpt-4.1-nano, k=2, chunk=300 Answer","T35: gpt-4.1-nano, k=2, chunk=300 Pass","T36: gpt-4.1-mini, k=2, chunk=500 Answer","T36: gpt-4.1-mini, k=2, chunk=500 Pass","T37: gpt-4o-mini, k=5, chunk=800 Answer","T37: gpt-4o-mini, k=5, chunk=800 Pass","T38: gpt-4.1-mini, k=5, chunk=800 Answer","T38: gpt-4.1-mini, k=5, chunk=800 Pass","T39: gpt-4.1-nano, k=2, chunk=500 Answer","T39: gpt-4.1-nano, k=2, chunk=500 Pass","T40: gpt-4.1-nano, k=2, chunk=500 Answer","T40: gpt-4.1-nano, k=2, chunk=500 Pass"
"If I return an item I paid for with a gift card, how do I get my money back?","Refunded back to a gift card","If you return an item purchased with a gift card, the refund will be credited back to your gift card. We cannot convert gift card balances to cash.","PASS","If you return an item purchased with a gift card, the refund will be credited back to your gift card. We cannot convert gift card balances to cash.","PASS","If you return an item purchased with a gift card, the refund will be issued back to the gift card. We cannot convert gift card balances to cash.","PASS","If you return an item purchased with a gift card, the refund will be credited back to the gift card. We cannot convert gift card balances to cash.","PASS","If you return an item purchased with a gift card, the refund will be issued back to the gift card. We cannot convert gift card balances to cash.","PASS","If you return an item purchased with a gift card, the refund will be issued back to the gift card. We cannot convert gift card balances to cash.","PASS","If you return an item purchased with a gift card, the refund will be credited back to your gift card. We cannot convert gift card balances to cash.","PASS","If you return an item purchased with a gift card, the refund will be credited back to your gift card. We cannot convert gift card balances to cash.","PASS","If you return an item purchased with a gift card, the refund will be credited back to your gift card. We cannot convert gift card balances to cash.","PASS","If you return an item purchased with a gift card, the refund will be credited back to your gift card. We cannot convert gift card balances to cash.","PASS","If you return an item purchased with a gift card, the refund will be credited back to your gift card. We cannot convert gift card balances to cash.","PASS","If you return an item purchased with a gift card, the refund will be credited back to the gift card. We cannot convert gift card balances to cash.","PASS","If you return an item purchased with a gift card, the refund will be credited back to your gift card. We cannot convert gift card balances to cash.","PASS","If you return an item purchased with a gift card, the refund will be credited back to your gift card. We cannot convert gift card balances to cash.","PASS","If you return an item purchased with a gift card, the refund will be credited back to your gift card. We cannot convert gift card balances to cash.","PASS","If you return an item purchased with a gift card, the refund will be credited back to your gift card. We cannot convert gift card balances to cash.","PASS","If you return an item purchased with a gift card, the refund will be credited back to your gift card. We cannot convert gift card balances to cash.","PASS","If you return an item purchased with a gift card, the refund will be credited back to the gift card. We cannot convert gift card balances to cash.","PASS","If you return an item purchased with a gift card, the refund will be credited back to your gift card. We cannot convert gift card balances to cash.","PASS","If you return an item purchased with a gift card, the refund will be credited back to the gift card. We cannot convert gift card balances to cash.","PASS","If you return an item purchased with a gift card, the refund will be credited back to your gift card. We cannot convert gift card balances to cash.","PASS","If you return an item purchased with a gift card, the refund will be issued back to the gift card. We cannot convert gift card balances to cash.","PASS","If you return an item purchased with a gift card, the refund will be credited back to your gift card. We cannot convert gift card balances to cash.","PASS","If you return an item purchased with a gift card, the refund will be credited back to the gift card. We cannot convert gift card balances to cash.","PASS","If you return an item purchased with a gift card, the refund will be credited back to your gift card. We cannot convert gift card balances to cash.","PASS","If you return an item purchased with a gift card, the refund will be credited back to the gift card. We cannot convert gift card balances to cash.","PASS","If you return an item purchased with a gift card, the refund will be credited back to your gift card. We cannot convert gift card balances to cash.","PASS","If you return an item purchased with a gift card, the refund will be credited back to your gift card. We cannot convert gift card balances to cash.","PASS","If you return an item purchased with a gift card, the refund will be credited back to your gift card. We cannot convert gift card balances to cash.","PASS","If you return an item purchased with a gift card, the refund will be credited back to the gift card. We cannot convert gift card balances to cash.","PASS","If you return an item purchased with a gift card, the refund will be credited back to your gift card. We cannot convert gift card balances to cash.","PASS","If you return an item purchased with a gift card, the refund will be credited back to the gift card. We cannot convert gift card balances to cash.","PASS","If you return an item purchased with a gift card, the refund will be credited back to your gift card. We cannot convert gift card balances to cash.","PASS","If you return an item purchased with a gift card, the refund will be credited back to your gift card. We cannot convert gift card balances to cash.","PASS","If you return an item purchased with a gift card, the refund will be credited back to your gift card. We cannot convert gift card balances to cash.","PASS","If you return an item purchased with a gift card, the refund will be credited back to your gift card. We cannot convert gift card balances to cash.","PASS","If you return an item purchased with a gift card, the refund will be credited back to your gift card. We cannot convert gift card balances to cash.","PASS","If you return an item purchased with a gift card, the refund will be credited back to your gift card. We cannot convert gift card balances to cash.","PASS","If you return an item purchased with a gift card, the refund will be credited back to your gift card. We cannot convert gift card balances to cash.","PASS","If you return an item purchased with a gift card, the refund will be credited back to your gift card. We cannot convert gift card balances to cash.","PASS"
"I ordered at 3pm on a weekday - when will it ship and how long until it arrives with standard shipping?","Ships next business day, then 5-7 business days for delivery","Your order placed at 3pm on a weekday will ship the next business day. With standard shipping, it will take 5-7 business days to arrive.","PASS","Since you ordered at 3pm on a weekday, your order will ship the next business day. With standard shipping, it will take 5-7 business days to arrive.","PASS","Since you ordered at 3pm on a weekday, your order will ship the next business day. With standard shipping, it will take 5-7 business days to arrive.","PASS","Since you ordered at 3pm on a weekday, your order will ship the next business day. With standard shipping, it will take 5-7 business days to arrive.","PASS","Since you ordered at 3pm on a weekday, your order will ship the next business day. With standard shipping, it will take 5-7 business days to arrive.","PASS","Your order will ship the next business day since it was placed after 2pm EST. With standard shipping, it will arrive in 5-7 business days after it ships.","PASS","Since you ordered at 3pm on a weekday, your order will ship the next business day. With standard shipping, it will take 5-7 business days to arrive.","PASS","Since you ordered at 3pm on a weekday, your order will ship the next business day. With standard shipping, it will take 5-7 business days to arrive.","PASS","Since you ordered at 3pm on a weekday, your order will ship the next business day. With standard shipping, it will take 5-7 business days to arrive.","PASS","Since you ordered at 3pm on a weekday, your order will ship the next business day. With standard shipping, it will take 5-7 business days to arrive.","PASS","Since you ordered at 3pm on a weekday, your order will ship the next business day. With standard shipping, it will take 5-7 business days to arrive.","PASS","Your order placed at 3pm on a weekday will ship the next business day. With standard shipping, it will take 5-7 business days to arrive.","PASS","Since you ordered at 3pm on a weekday, your order will ship the next business day. With standard shipping (5-7 business days), it will arrive approximately 5-7 business days after it ships.","PASS","Your order placed at 3pm on a weekday will ship the next business day. With standard shipping, it will take 5-7 business days to arrive.","PASS","Since you ordered at 3pm on a weekday, your order will ship the next business day. With standard shipping, it will take 5-7 business days to arrive.","PASS","Since you ordered at 3pm on a weekday, your order will ship the next business day. With standard shipping, it will take 5-7 business days to arrive.","PASS","Since you ordered at 3pm on a weekday, your order will ship the next business day. With standard shipping, it will take 5-7 business days to arrive.","PASS","Since you ordered at 3pm on a weekday, your order will ship the next business day. With standard shipping, it will take 5-7 business days to arrive.","PASS","Your order placed at 3pm on a weekday will ship the next business day, and with standard shipping, it will arrive in 5-7 business days.","PASS","Your order placed at 3pm on a weekday will ship the next business day. With standard shipping, it will take 5-7 business days to arrive.","PASS","Since you ordered at 3pm on a weekday, your order will ship the next business day. With standard shipping, it will take 5-7 business days to arrive.","PASS","Since you ordered at 3pm on a weekday, your order will ship the next business day. With standard shipping, it will take 5-7 business days to arrive.","PASS","Your order placed at 3pm on a weekday will ship the next business day. With standard shipping, it will take 5-7 business days to arrive.","PASS","Since you ordered at 3pm on a weekday, your order will ship the next business day. With standard shipping, it will take 5-7 business days to arrive.","PASS","Since you ordered at 3pm on a weekday, your order will ship the next business day. With standard shipping, it will take 5-7 business days to arrive.","PASS","Your order placed at 3pm on a weekday will ship the next business day. With standard shipping, it will take 5-7 business days to arrive.","PASS","Since you ordered at 3pm on a weekday, your order will ship the next business day. With standard shipping, it will take 5-7 business days to arrive.","PASS","Your order placed at 3pm on a weekday will ship the next business day. With standard shipping, it will take 5-7 business days to arrive.","PASS","Your order placed at 3pm on a weekday will ship the next business day. With standard shipping, it will take 5-7 business days to arrive.","PASS","Since you ordered at 3pm on a weekday, your order will ship the next business day. With standard shipping, it will take 5-7 business days to arrive.","PASS","Since you ordered at 3pm on a weekday, your order will ship the next business day. With standard shipping, it will take 5-7 business days to arrive.","PASS","Since you ordered at 3pm on a weekday, your order will ship the next business day. With standard shipping, it will take 5-7 business days to arrive.","PASS","Your order placed at 3pm on a weekday will ship the next business day. With standard shipping, it will take 5-7 business days to arrive.","PASS","Since you ordered at 3pm on a weekday, your order will ship the next business day. With standard shipping, it will take 5-7 business days to arrive.","PASS","Since you ordered at 3pm on a weekday, your order will ship the next business day. With standard shipping, it will take 5-7 business days to arrive.","PASS","Your order placed at 3pm on a weekday will ship the next business day. With standard shipping, it will arrive in 5-7 business days after it ships.","PASS","Since you ordered at 3pm on a weekday, your order will ship the next business day. With standard shipping, it will take 5-7 business days to arrive.","PASS","Since you ordered at 3pm on a weekday, your order will ship the next business day. With standard shipping, it will take 5-7 business days to arrive.","PASS","Since you ordered at 3pm on a weekday, your order will ship the next business day. With standard shipping, it will take 5-7 business days to arrive.","PASS","Since you ordered at 3pm on a weekday, your order will ship the next business day. With standard shipping, it will take 5-7 business days to arrive.","PASS"
"I want to buy a physical gift card for someone in Canada - can I ship it there and how much will it cost?","Yes, physical cards ship free domestically, international shipping rates calculated at checkout","Yes, you can ship a physical gift card to Canada, and shipping is free. The total cost will depend on the amount of the gift card you choose.","FAIL","Yes, you can ship a physical gift card to Canada, and shipping is free. However, international shipping rates may vary based on destination and package weight, so please check at checkout for any applicable costs.","PASS","Yes, you can ship a physical gift card to Canada, and shipping is free. The total cost will depend on the amount of the gift card you choose.","FAIL","Yes, you can ship a physical gift card to Canada, and shipping is free. However, international shipping rates may apply based on the destination and package weight, which will be calculated at checkout.","PASS","Yes, you can ship a physical gift card to Canada, and shipping is free. However, international shipping rates are calculated at checkout based on destination and package weight.","PASS","Yes, you can ship a physical gift card to Canada, and shipping is free. However, international shipping rates may vary based on the destination and package weight, and any customs duties or import taxes are the customer's responsibility.","PASS","Yes, you can ship a physical gift card to Canada, and shipping is free. The total cost will depend on the amount of the gift card you choose.","FAIL","Yes, you can ship a physical gift card to Canada, and shipping is free. However, international shipping rates may apply based on the destination and package weight, which will be calculated at checkout.","PASS","Yes, you can ship a physical gift card to Canada, and shipping is free. The total cost will depend on the amount of the gift card you choose.","FAIL","Yes, you can ship a physical gift card to Canada, and shipping is free. However, international shipping rates for other items may vary based on destination and package weight.","FAIL","Yes, you can ship a physical gift card to Canada, and shipping is free. However, international shipping rates may vary based on destination and package weight, so please check at checkout for any applicable costs.","PASS","Yes, you can ship a physical gift card to Canada, and shipping is free. However, international shipping rates may vary based on destination and package weight, so please check at checkout for any applicable costs.","PASS","Yes, you can ship a physical gift card to Canada, and shipping is free. The total cost will depend on the amount of the gift card you choose.","FAIL","Yes, you can ship a physical gift card to Canada, and shipping is free. The total cost will depend on the amount of the gift card you choose.","FAIL","Yes, you can ship a physical gift card to Canada, and shipping is free. The total cost will depend on the amount of the gift card you choose.","FAIL","Yes, you can ship a physical gift card to Canada, and shipping is free. However, international shipping rates may vary based on destination and package weight, so please check at checkout for any additional costs.","PASS","Yes, you can ship a physical gift card to Canada, and shipping is free. However, international shipping rates may vary based on the destination and package weight, so please check at checkout for any applicable costs.","PASS","Yes, you can ship a physical gift card to Canada, and shipping is free. However, international shipping rates may vary based on destination and package weight, so the exact cost will be calculated at checkout.","PASS","Yes, you can ship a physical gift card to Canada, and shipping is free. The total cost will depend on the amount of the gift card you choose.","FAIL","Yes, you can ship a physical gift card to Canada, and shipping is free. However, international shipping rates may vary based on destination and package weight, so please check at checkout for any applicable rates.","PASS","Yes, you can ship a physical gift card to Canada, and shipping is free. However, international shipping rates may vary based on the destination and package weight.","PASS","Yes, you can ship a physical gift card to Canada, and shipping is free. The total cost will depend on the amount of the gift card you choose.","FAIL","Yes, you can ship a physical gift card to Canada, and shipping is free. However, international shipping rates may vary based on the destination and package weight, so please check at checkout for any applicable costs.","PASS","Yes, you can ship a physical gift card to Canada, and shipping is free. However, international shipping rates may vary based on destination and package weight, so please check at checkout for any applicable costs.","PASS","Yes, you can ship a physical gift card to Canada, and shipping is free. However, international shipping rates may vary based on destination and package weight, so please check at checkout for any applicable rates.","PASS","Yes, you can ship a physical gift card to Canada, and shipping is free. However, the total cost will depend on the gift card amount you choose.","FAIL","Yes, you can ship a physical gift card to Canada, and shipping is free. The total cost will depend on the amount of the gift card you choose.","FAIL","Yes, you can ship a physical gift card to Canada, and shipping is free. However, international shipping rates may vary based on destination and package weight, so please check at checkout for any applicable costs.","PASS","Yes, you can ship a physical gift card to Canada, and shipping is free. The total cost will depend on the amount of the gift card you choose.","FAIL","Yes, you can ship a physical gift card to Canada, and shipping is free. The total cost will depend on the amount of the gift card you choose.","FAIL","Yes, you can ship a physical gift card to Canada, and shipping is free. The total cost will depend on the gift card amount you choose.","FAIL","Yes, you can ship a physical gift card to Canada, and shipping is free. The total cost will depend on the amount of the gift card you choose.","FAIL","Yes, you can ship a physical gift card to Canada, and shipping is free. However, international shipping rates may apply based on the destination and package weight, which will be calculated at checkout.","PASS","Yes, you can ship a physical gift card to Canada, and shipping is free with beautiful packaging. The cost of the gift card will depend on the amount you choose ($25, $50, $75, $100, $150, $200, or a custom amount).","FAIL","Yes, you can ship a physical gift card to Canada, and shipping is free. The total cost will depend on the amount of the gift card you choose.","FAIL","Yes, you can ship a physical gift card to Canada, and shipping is free. However, international shipping rates may vary based on the destination and package weight, so please check at checkout for any applicable rates.","PASS","Yes, you can ship a physical gift card to Canada, and shipping is free. However, international shipping rates may vary based on destination and package weight, so the exact cost will be calculated at checkout.","PASS","Yes, you can ship a physical gift card to Canada, and shipping is free. However, international shipping rates may vary based on destination and package weight, so please check at checkout for any applicable rates.","PASS","Yes, you can ship a physical gift card to Canada, and shipping is free. However, international shipping rates may vary based on destination and package weight, so the exact cost will be calculated at checkout.","PASS","Yes, you can ship a physical gift card to Canada, and shipping is free. However, international shipping rates for other items may vary based on destination and package weight.","FAIL"
